{
  "envelope_id": "11111111-1111-4111-8111-111111111111",
  "tenant_id": "22222222-2222-4222-8222-222222222222",
  "received_at_ns": 1700000000000000000,
  "scanner_type": "edr",
  "scanner_version": "1.0.0",
  "ocsf_class": 4002,
  "raw_finding": {
    "source_finding_id": "synthetic-finding-001",
    "source_event_uid": "synthetic-event-001",
    "title": "Synthetic suspicious process observation",
    "description": "Synthetic bounded finding for local contract validation only.",
    "severity": "medium",
    "observed_at_ns": 1700000000000000000
  },
  "normalized_finding": {
    "ocsf_class_uid": 4002,
    "category_uid": 4,
    "type_uid": 400201,
    "activity_id": 1,
    "severity_id": 3,
    "finding_uid": "synthetic-finding-001"
  },
  "ingest_provenance": {
    "adapter": "synthetic",
    "adapter_version": "1.0.0"
  }
}
